{
  "$schema": "./_schema/screen.schema.json",
  "id": "ORD-17",
  "module": "quality",
  "titleKey": "Nav.Quality",
  "route": "/quality/queue",
  "pattern": "Custom",
  "phase": 4,
  "status": "planned",
  "permissions": {
    "view": "quality.read",
    "access": "permission"
  },
  "entities": [],
  "api": [],
  "rules": [],
  "states": [
    "loading"
  ],
  "offline": {
    "mode": "blocked",
    "why": "requires live server-side checks"
  },
  "sensitive": {},
  "aiAssist": {
    "allowed": [
      "explainScreen"
    ],
    "forbidden": [
      "changeData",
      "changePermissions"
    ],
    "contextFields": []
  },
  "tests": [
    "ORD-17.happy",
    "ORD-17.permissionDenied"
  ],
  "relatedScreens": []
}
