{
  "$schema": "./_schema/screen.schema.json",
  "id": "CUS-09",
  "module": "customers",
  "titleKey": "Nav.Customers",
  "route": "/customers/merge",
  "pattern": "Custom",
  "phase": 7,
  "status": "planned",
  "permissions": {
    "view": "customers.merge",
    "access": "permission"
  },
  "entities": [],
  "api": [],
  "rules": [],
  "states": [
    "loading"
  ],
  "offline": {
    "mode": "blocked",
    "why": "requires live server-side checks"
  },
  "sensitive": {},
  "aiAssist": {
    "allowed": [
      "explainScreen"
    ],
    "forbidden": [
      "changeData",
      "changePermissions"
    ],
    "contextFields": []
  },
  "tests": [
    "CUS-09.happy",
    "CUS-09.permissionDenied"
  ],
  "relatedScreens": [],
  "notes": "Planned: deferred from phase 2 until the documents it depends on exist."
}
